{
 "version": 1,
 "style": "anime",
 "series": "LAUNCH DAY",
 "title": "MMX Heist Anime",
 "bed": "bedG_cinepulse",
 "captions": "../../../../lab/ultra/kit/captions.json",
 "voice": "../../../../lab/ultra/kit/voice.mp3",
 "facts": "../../../../lab/ultra/kit/facts.md",
 "stress": ["collision", "heist", "steal", "2027.", "lookout.", "25", "15", "grab.", "nitrogen", "10", "2031.", "loot?", "First"],
 "assets": {
  "phobos": { "file": "../../../../lab/ultra/anime/assets/phobos_a.png", "credit": "NASA/JPL-Caltech/University of Arizona", "focus": [0.1, 0.1, 0.8, 0.8], "note": "PIA10368, masked cutout (resize and alpha mask only)" },
  "mars": { "file": "../../../../lab/ultra/anime/assets/mars.png", "credit": "NASA/JPL/USGS", "focus": [0.1, 0.1, 0.8, 0.8], "note": "PIA00407, masked cutout" },
  "earthset": { "file": "../../../../lab/ultra/anime/assets/earth_setting.jpg", "credit": "NASA/JPL-Caltech/MSSS", "focus": [0.03, 0.02, 0.32, 0.15], "fill": 1.15, "note": "PIA26362, the inset with Phobos and Earth" }
 },
 "impacts": ["collision", "heist", "2027.", "15", "grab.", "10", "burn", "2031."],
 "beats": [
  { "id": "hook", "start": "This", "shot": { "type": "hook", "image": "phobos", "frame": "cutout", "width": 1000, "pos": [540, 760], "bg": "focus", "spin": 0.03 },
    "chips": [{ "at": "collision+12f", "lines": ["IN 50 MILLION YEARS:", "CRASH INTO MARS", "OR BREAK UP INTO A RING", { "t": "SOURCE: NASA", "c": "muted" }] }],
    "sfx": [{ "text": "ゴゴゴ", "at": 0, "for": 50, "pos": [640, 400], "size": 80, "rot": 0.08 }] },
  { "id": "launch", "start": "Japan", "transition": { "type": "whip", "dir": "up" }, "source": "JAXA",
    "shot": { "type": "craft", "craft": "rocket", "bg": "pad", "pos": [790, 1690], "scale": 1.27, "liftoff": { "at": "launched" }, "push": 0.06 },
    "chips": [{ "at": "Japan+4f", "lines": ["H3 FLIGHT No.10 · TANEGASHIMA", "LIFTOFF 04:41:03 JST, OCT 20, 2026", { "t": "(19:41:03 UTC, OCT 19)", "c": "muted" }], "size": 28 }],
    "sfx": [{ "text": "ドドド", "at": "launched", "for": 14, "pos": [120, 900], "size": 110, "rot": -0.15 }] },
  { "id": "heist", "start": "a#2", "hit": true, "transition": { "type": "cut" },
    "shot": { "type": "react", "who": "ns", "bg": "red", "turn_in": true, "faces": [{ "at": "heist", "expr": "smirk", "p": { "slant": 0.55, "glint": 1 } }] },
    "sfx": [{ "text": "ドン", "at": "heist", "for": 20, "pos": [615, 405], "size": 120, "rot": 0.12 }] },
  { "id": "target", "start": "steal", "transition": { "type": "whip", "dir": "left" }, "source": "NASA",
    "shot": { "type": "react", "who": "pho", "pos": [690, 640], "size": 245, "bg": "focus", "reticle": { "at": "steal", "piece_at": "piece#1" }, "piece": "piece#1",
              "faces": [{ "at": "steal", "expr": "grumpy" }, { "at": "piece#1", "expr": "alarm", "sweat": true }, { "at": "it.#1", "expr": "furious" }] },
    "chips": [{ "at": "steal+8f", "lines": ["TARGET: PHOBOS", { "t": "27 x 22 x 18 km", "c": "amber" }], "size": 30 }],
    "sfx": [{ "text": "ムカッ", "at": "it.#1", "for": 18, "pos": [640, 410], "size": 80, "color": "red" }] },
  { "id": "step1", "start": "Step#1", "source": "NASA", "shot": { "type": "band", "style": 1, "num": "1", "words": ["Step#1", "one#1"], "step": 1, "steps": 4 } },
  { "id": "mars", "start": "Mars,#2", "shot": { "type": "photo", "image": "mars", "frame": "cutout", "width": 1060, "pos": [560, 820], "bg": "space" },
    "chips": [{ "at": "2027.+8f", "lines": ["JUST UNDER ONE YEAR", "EACH WAY (JAXA)"] }],
    "sfx": [{ "text": "ドン", "at": "2027.", "for": 20, "pos": [615, 1060], "size": 110, "rot": 0.1 }] },
  { "id": "step2", "start": "Step#2", "source": "DLR", "shot": { "type": "band", "style": 2, "num": "2", "words": ["Step#2", "two:"], "step": 2, "steps": 4 } },
  { "id": "drop", "start": "drop", "source": "DLR, ESA",
    "shot": { "type": "craft", "craft": "rover", "bg": "phobos", "pos": [600, 690], "scale": 0.8, "keys": [{ "at": "drop+4f", "pos": [600, 1004], "frames": 23 }, { "at": "kilo", "scale": 1.2, "frames": 10 }], "ease": "in" },
    "chips": [{ "at": "drop+4f", "until": "A#5", "lines": ["DROPPED FROM ABOUT 40 M,", "IN FREE FALL (DLR)"] }, { "at": "kilo", "lines": ["ABOUT THE SIZE OF", "A CRATE OF DRINKS (DLR)"] }],
    "sfx": [{ "text": "ズン", "at": "lookout.", "for": 18, "pos": [140, 820], "size": 90 }] },
  { "id": "weighs", "start": "On#2", "transition": { "type": "whip", "dir": "up" }, "source": "DLR, ESA",
    "shot": { "type": "react", "who": "pho", "pos": [540, 820], "size": 330, "bg": "space", "faces": [{ "at": "On#2", "expr": "grumpy", "look": [0.1, -1] }, { "at": "weighs...", "expr": "alarm", "look": [0, -1] }] },
    "chips": [{ "at": "On#2+6f", "lines": ["25 KG ROVER.", "ON PHOBOS IT WEIGHS", "THE EQUIVALENT OF", { "t": "15 GRAMS (ESA)", "c": "amber" }] }] },
  { "id": "shock", "start": "15", "transition": { "type": "smash" },
    "shot": { "type": "react", "who": "ns", "bg": "cyan", "rim": "cyan", "faces": [{ "at": "15", "expr": "shock" }] },
    "sfx": [{ "text": "エッ!?", "at": "15+2f", "for": 30, "pos": [515, 1010], "size": 110, "color": "cyan" }] },
  { "id": "step3", "start": "Step#3", "source": "JAXA", "shot": { "type": "band", "style": 3, "num": "3", "words": ["Step#3", "three#1"], "step": 3, "steps": 4 } },
  { "id": "grab", "start": "the#1", "shot": { "type": "react", "who": "ns", "bg": "red", "pos": [540, 470], "size": 210, "faces": [{ "at": "the#1", "expr": "grit" }], "paw": { "at": "grab.", "close_at": "grab.+6f" } },
    "sfx": [{ "text": "ガシッ", "at": "grab.", "for": 18, "pos": [135, 740], "size": 120 }] },
  { "id": "core", "start": "Coring", "transition": { "type": "whip", "dir": "left" }, "source": "JAXA, NASA",
    "shot": { "type": "craft", "craft": "probe", "bg": "phobos", "pos": [600, 790], "scale": 1.65, "legs": 1, "sampler": true, "wing": 0.7, "arm": { "at": "Coring" } },
    "chips": [{ "at": "Coring+4f", "until": "nitrogen", "lines": ["CORER DIGS TO 2 CM (JAXA)"] }, { "at": "nitrogen+3f", "lines": ["BURSTS OF HIGH-PRESSURE", "NITROGEN GAS (NASA)"] }],
    "sfx": [{ "text": "バシュッ", "at": "nitrogen", "for": 18, "pos": [450, 640], "size": 110, "color": "cyan" }] },
  { "id": "ten", "start": "Target:", "transition": { "type": "iris", "at": [540, 690] }, "source": "JAXA",
    "shot": { "type": "react", "who": "pho", "pos": [560, 700], "size": 300, "bg": "focus", "reticle": { "at": "Target:", "piece_at": "10" }, "piece": "Target:",
              "faces": [{ "at": "Target:", "expr": "grumpy" }, { "at": "at", "expr": "alarm" }, { "at": "least", "expr": "furious" }] },
    "chips": [{ "at": "10+6f", "lines": ["HAYABUSA2 AIMED FOR 0.1 G", "AND GOT 5.4 G (JAXA)"] }],
    "sfx": [{ "text": "ロックオン", "at": "10", "for": 20, "pos": [550, 1150], "size": 64, "color": "red" }] },
  { "id": "step4", "start": "Step#4", "source": "JAXA", "shot": { "type": "band", "style": 4, "num": "4", "words": ["Step#4", "four:"], "step": 4, "steps": 4 } },
  { "id": "burn", "start": "one#2", "source": "JAXA",
    "shot": { "type": "craft", "craft": "probe", "bg": "mars", "pos": [620, 880], "scale": 1.1, "rot": -0.75, "burn": { "at": "burn" }, "keys": [{ "at": "burn", "pos": [1250, -300], "frames": 40 }], "ease": "in", "speed": -55 },
    "sfx": [{ "text": "ゴオッ", "at": "burn", "for": 18, "pos": [120, 760], "size": 110 }] },
  { "id": "capsule", "start": "Capsule", "transition": { "type": "whip", "dir": "down-left" }, "source": "JAXA, ESA, NASA",
    "shot": { "type": "craft", "craft": "capsule", "bg": "earth", "backdrop": { "ex": 540, "ey": 930, "er": 470, "lon0": 128 }, "pos": [1020, 240], "scale": 0.7, "plasma": { "at": "Capsule", "until": "2031." }, "keys": [{ "at": "Capsule", "pos": [560, 980], "frames": 24 }], "speed": 125 },
    "chips": [{ "at": "Capsule+4f", "lines": ["SAMPLE CAPSULE: ABOUT 60 CM", "ACROSS, WITH A HEAT SHIELD (ESA)"] }],
    "sfx": [{ "text": "ドン", "at": "2031.", "for": 19, "pos": [615, 640], "size": 110, "rot": 0.1 }] },
  { "id": "loot", "start": "2031.+24f", "transition": { "type": "whip", "dir": "left" }, "source": "JAXA, ESA",
    "shot": { "type": "react", "who": "pho", "bg": "rays", "pos": [700, 640], "size": 230, "faces": [{ "at": "2031.+24f", "expr": "grumpy" }, { "at": "loot?", "expr": "furious" }] } },
  { "id": "first", "start": "First", "transition": { "type": "smash" }, "shot": { "type": "photo", "image": "phobos", "frame": "cutout", "width": 940, "pos": [540, 760], "bg": "rays", "sparkle": true, "slam": true } },
  { "id": "home", "start": "ever", "transition": { "type": "iris", "at": [540, 700] }, "shot": { "type": "photo", "image": "earthset", "frame": "monitor", "pull": true, "lean_at": "home.", "marks": [{ "at": "brought", "point": [0.274, 0.084], "r": 22 }] }, "caption": { "y": 790, "maxY": 1040, "size": 100 } },
  { "id": "nextband", "start": "Next:", "source": "Launch Library 2", "shot": { "type": "band", "style": "next", "words": ["Next:", "Next:"], "stamp": { "text": "WED 21 OCT", "at": "Next:" } } },
  { "id": "electron", "start": "aims", "source": "Launch Library 2",
    "shot": { "type": "next", "scene": "rocket", "chip": ["ROCKET LAB ELECTRON", "THREE HAWKEYE 360 SATELLITES", { "t": "WED 21 OCT", "c": "amber" }], "stamp": { "text": "WED 21 OCT", "at": "Wednesday." } } },
  { "id": "end", "start": "Follow", "transition": { "type": "whip", "dir": "up" }, "shot": { "type": "end", "downlink": "Downlink", "cat": "Cat." } }
 ],
 "cast": {
  "ns": { "moves": [
    { "at": "steal", "do": "enter", "place": "low-left", "how": "slide" },
    { "at": "steal+2f", "do": "point", "target": "el:face" },
    { "at": "piece#1", "do": "expr", "expr": "smirk" },
    { "at": "Step#1-10f", "do": "exit", "how": "slide" },
    { "at": "lookout.", "do": "enter", "place": "peek-right", "how": "smear" },
    { "at": "kilo", "do": "expr", "expr": "grin" },
    { "at": "On#2-12f", "do": "exit", "how": "slide" },
    { "at": "Coring+6f", "do": "enter", "place": "low-left", "how": "pop" },
    { "at": "nitrogen", "do": "gasp" },